{
  "id": "mario-quadratic-jump",
  "title": "점프! 이차함수 코인 러시",
  "language": "ko",
  "audience": "중3 수학, 이차함수의 그래프 (꼭짓점형)",
  "learningGoals": [
    "꼭짓점형 y=a(x-p)^2+q에서 a, p, q의 역할을 설명한다.",
    "곡선이 주어진 점들을 지나도록 계수를 조절한다.",
    "포물선의 폭과 방향을 a의 부호·크기와 연결한다."
  ],
  "sourceInspiration": {
    "url": "https://classroom.amplify.com/activity/5c7614041509d870d4838bfd",
    "confirmedFacts": [
      { "label": "원형", "value": "Super Mario Quadratics (John Rowe)" },
      { "label": "메커니즘", "value": "조이스틱 대신 학생이 이차함수를 작성해 캐릭터가 포물선을 따라 점프" },
      { "label": "난이도 곡선", "value": "초반 = 주어진 식 수정, 후반 = 처음부터 작성" }
    ]
  },
  "screens": [
    {
      "id": "s01-intro",
      "title": "함수가 곧 조종간",
      "template": "cover_fact_card",
      "purpose": "캐릭터는 여러분이 쓴 함수 곡선을 따라 달린다는 규칙을 소개한다.",
      "prompt": "이 게임에는 방향키가 없습니다. 여러분이 쓰는 함수가 곧 캐릭터의 길입니다."
    },
    {
      "id": "s02-edit",
      "title": "레벨 1: 식 고치기",
      "template": "platformer_mario",
      "purpose": "주어진 -0.5(x-3)^2+3에서 q만 고쳐 코인 3개를 먹는다.",
      "input": "s02_jump",
      "button": "s02_run",
      "graph": "s02_stage",
      "hud": "s02_hud",
      "coins": [[2, 3.5], [3, 4], [4, 3.5]],
      "startX": 0,
      "speed": 1,
      "duration": 8,
      "teacherMoves": ["initialLatex로 -0.5(x-3)^2+3을 넣어 두세요 (y= 없이 — simpleFunction은 방정식을 못 받습니다). q를 1 올리면 해결됩니다."]
    },
    {
      "id": "s03-predict",
      "title": "a를 바꾸면?",
      "template": "notice_predict",
      "purpose": "a의 크기를 바꾸면 어떤 코인을 놓치는지 예상한다.",
      "choice": "s03_prediction",
      "reason": "s03_reason",
      "feedback": "s03_predFeedback",
      "beforeSubmitMessage": "a를 -2로 바꾸면 포물선은 어떻게 될까요?",
      "afterSubmitMessage": "다음 레벨에서 직접 확인해 봅시다."
    },
    {
      "id": "s04-build",
      "title": "레벨 2: 처음부터 작성",
      "template": "platformer_mario",
      "purpose": "코인 3개를 모두 지나는 이차함수를 처음부터 작성한다.",
      "input": "s04_jump",
      "button": "s04_run",
      "graph": "s04_stage",
      "hud": "s04_hud",
      "coins": [[1, 2], [3.5, 5], [6, 2]],
      "startX": 0,
      "speed": 1,
      "duration": 8
    },
    {
      "id": "s05-table",
      "title": "코인 좌표를 표로 정리",
      "template": "table_check",
      "purpose": "레벨 2 코인 좌표를 표로 정리하며 대칭축을 찾는다.",
      "table": "s05_table",
      "feedback": "s05_feedback",
      "expectedRows": [2, 5, 2],
      "correctMessage": "코인 좌표가 모두 맞습니다. 대칭축이 보이나요?",
      "tryAgainMessage": "각 코인의 y좌표를 다시 확인해 보세요."
    },
    {
      "id": "s06-reflect",
      "title": "포물선 설계 노트",
      "template": "reflection",
      "purpose": "꼭짓점과 코인 좌표로 식을 세운 과정을 설명한다.",
      "response": "s06_reflection",
      "note": "s06_prompt",
      "prompt": "꼭짓점을 어디로 정했고, a는 어떻게 구했는지 설명하세요."
    }
  ]
}
