{
  "id": "marble-run-linear",
  "title": "구슬 미끄럼틀: 일차함수로 별 모으기",
  "language": "ko",
  "audience": "중학교 수학, 일차함수 식 세우기",
  "learningGoals": [
    "기울기와 y절편을 조절해 원하는 직선을 만든다.",
    "직선이 특정 점들을 지나도록 식을 수정한다.",
    "함수식의 변화가 그래프 모양에 주는 영향을 설명한다."
  ],
  "sourceInspiration": {
    "url": "https://classroom.amplify.com/activity/566b31734e38e1e21a10aac8",
    "confirmedFacts": [
      { "label": "원형", "value": "Marbleslides: Lines (Desmos 공식, 2015)" },
      { "label": "설계 근거", "value": "real marbleslides에는 CL이 없어 graph-clone으로 재구현 (cl.desmos.com/t/343, t/8681)" },
      { "label": "화면 구조", "value": "Fix It → Predict → Challenge 단계 구조 차용" }
    ]
  },
  "screens": [
    {
      "id": "s01-intro",
      "title": "구슬을 별까지 굴려 보자",
      "template": "cover_fact_card",
      "purpose": "공이 직선을 따라 굴러 별을 모으는 규칙을 소개한다.",
      "prompt": "공은 (1, 8)에서 떨어져 여러분이 만든 직선을 타고 굴러갑니다. 별을 모두 모아 보세요."
    },
    {
      "id": "s02-fix-it",
      "title": "Fix It: 숫자 하나만 바꾸기",
      "template": "marbleslides_style",
      "purpose": "주어진 식 -0.5x+6에서 y절편 하나만 고쳐 별 2개를 모은다 (별들의 기울기는 이미 -0.5).",
      "input": "s02_line",
      "button": "s02_launch",
      "graph": "s02_marbleGraph",
      "feedback": "s02_feedback",
      "dropPoint": [1, 8],
      "stars": [[3, 4], [6, 2.5]],
      "duration": 6,
      "teacherMoves": ["initialLatex로 -0.5x+6을 미리 넣어 '수정' 과제로 만드세요 (y= 없이 — simpleFunction은 방정식을 못 받습니다). 절편을 5.5로 고치면 두 별 (3,4),(6,2.5)를 모두 지납니다."]
    },
    {
      "id": "s03-predict",
      "title": "Predict: 굴리기 전에 예상하기",
      "template": "notice_predict",
      "purpose": "기울기를 바꾸면 공이 어느 별을 지나게 될지 먼저 예상한다.",
      "choice": "s03_prediction",
      "reason": "s03_reason",
      "feedback": "s03_predFeedback",
      "beforeSubmitMessage": "굴리기 전에: 기울기를 더 가파르게 하면 어떤 별을 놓칠까요?",
      "afterSubmitMessage": "좋아요. 다음 화면에서 직접 확인해 봅시다."
    },
    {
      "id": "s04-challenge",
      "title": "Challenge: 별 3개를 한 직선으로",
      "template": "marbleslides_style",
      "purpose": "별 3개를 모두 지나는 직선을 처음부터 작성한다.",
      "input": "s04_line",
      "button": "s04_launch",
      "graph": "s04_marbleGraph",
      "feedback": "s04_feedback",
      "dropPoint": [0, 9],
      "stars": [[2, 5], [4, 3], [8, -1]],
      "duration": 6
    },
    {
      "id": "s05-reflect",
      "title": "전략 설명하기",
      "template": "reflection",
      "purpose": "별 좌표에서 기울기를 어떻게 구했는지 설명한다.",
      "response": "s05_reflection",
      "note": "s05_prompt",
      "prompt": "별 두 개의 좌표만 보고 직선의 식을 세우는 자신만의 방법을 설명하세요."
    }
  ]
}
